{
  "x402": {
    "verb": "summarize",
    "version": "1.0.0",
    "request_id": "req-summarize-2025-11-19-0001"
  },
  "actor": "did:example:caller-001",
  "limits": {
    "max_output_tokens": 512
  },
  "channel": {
    "protocol": "https",
    "input_modalities": ["text"],
    "output_modalities": ["text"]
  },
  "input": {
    "content": "CommandLayer defines a canonical verb and schema layer for agent-to-agent communication, aligned with x402 and ERC-8004. The commons repo contains 10 stable verbs with strict JSON Schema definitions and examples used for interoperability."
  }
}
